{
  "metadata": {
    "strategy_id": "outside_red_flat_v1",
    "name": "Outside Red Flat Bet",
    "description": "Single outside bet, fixed unit sizing.",
    "version": "1.0.0",
    "created_utc": "2026-03-02T00:00:00Z",
    "tags": ["outside", "flat", "starter"]
  },
  "roulette": {
    "table_type": "american",
    "wheel_bias_model": "fair"
  },
  "bankroll": {
    "starting_bankroll": 1000,
    "currency": "USD",
    "base_unit": 5
  },
  "table_limits": {
    "min_bet": 5,
    "max_bet_per_spot": 500,
    "max_total_bet_per_spin": 500
  },
  "session_rules": {
    "max_spins": 200,
    "stop_loss": 250,
    "stop_win": 200,
    "max_drawdown_pct": 35,
    "cooldown_spins_after_loss_streak": 0
  },
  "bet_plan": {
    "entries": [
      {
        "spot_id": "outside_red",
        "units": 1,
        "enabled": true
      }
    ],
    "progression": {
      "mode": "flat",
      "step_up_after_loss": 0,
      "step_down_after_win": 0,
      "max_multiplier": 1
    }
  },
  "simulation": {
    "trials": 50000,
    "spins_per_trial": 200,
    "seed": 42
  },
  "compliance": {
    "entertainment_only": true,
    "disclaimer_accepted": true
  }
}
